{
	"error" : null,
	"command" : "/usr/lib64/R/bin/exec/R --no-echo --no-restore --no-save --slave --file=/home/janneke/TCPDBench/execs/R/cpdbench_wbs.R --args -i /home/janneke/TCPDBench/datasets/usd_isk.json -K default -p SSIC -g true",
	"script" : "/home/janneke/TCPDBench/execs/R/cpdbench_wbs.R",
	"script_md5" : "155041b2e01ba0b7ece7753cb145ea9a",
	"hostname" : "hex-portable",
	"dataset" : "usd_isk",
	"dataset_md5" : "5cac2807a0e280c8ffd7321662e339ac",
	"status" : "SUCCESS",
	"parameters" : {
		"M" : 5000,
		"rand.intervals" : true,
		"Kmax" : 50,
		"integrated" : true,
		"penalty" : "SSIC"
	},
	"result" : {
		"cplocations" : [
			15,
			19,
			26,
			39,
			46,
			48,
			58,
			69,
			70,
			85,
			90,
			98,
			107,
			109,
			112,
			115,
			116,
			119,
			122,
			138,
			154,
			178,
			190,
			206,
			211,
			219,
			236
		],
		"runtime" : 0.03706837
	}
} 
