{
	"error" : null,
	"command" : "/usr/lib64/R/bin/exec/R --no-echo --no-restore --no-save --slave --file=/home/janneke/TCPDBench/execs/R/cpdbench_prophet.R --args -i /home/janneke/TCPDBench/datasets/gdp_argentina.json -N default",
	"script" : "/home/janneke/TCPDBench/execs/R/cpdbench_prophet.R",
	"script_md5" : "651dab1a04514f68e3d9719059dbc93f",
	"hostname" : "hex-portable",
	"dataset" : "gdp_argentina",
	"dataset_md5" : "694212b5682ebd808d740ffd83d4bc16",
	"status" : "SUCCESS",
	"parameters" : {
		"changepoint.range" : 1,
		"threshold" : 0.01,
		"yearly.seasonality" : "auto",
		"weekly.seasonality" : "auto",
		"daily.seasonality" : "auto",
		"Nmax" : 25
	},
	"result" : {
		"cplocations" : [
			26,
			28,
			30,
			35,
			37,
			39,
			42,
			44
		],
		"runtime" : 0.1935856
	}
} 
