{
	"error" : null,
	"command" : "/usr/lib64/R/bin/exec/R --no-echo --no-restore --no-save --slave --file=/home/janneke/TCPDBench/execs/R/cpdbench_changepointnp.R --args -i /home/janneke/TCPDBench/datasets/scanline_126007.json -p MBIC -q 10",
	"script" : "/home/janneke/TCPDBench/execs/R/cpdbench_changepointnp.R",
	"script_md5" : "900c8687ad78bde19902400624e57d8b",
	"hostname" : "hex-portable",
	"dataset" : "scanline_126007",
	"dataset_md5" : "057d5741b623308af00c42e2c8e525c3",
	"status" : "SUCCESS",
	"parameters" : {
		"method" : "PELT",
		"test.stat" : "empirical_distribution",
		"minseglen" : 1,
		"nquantiles" : 10,
		"penalty" : "MBIC"
	},
	"result" : {
		"cplocations" : [
			106,
			113,
			163,
			250,
			265,
			279,
			291,
			306,
			315,
			324,
			353,
			363,
			375,
			402,
			480
		],
		"runtime" : 0.004576206
	}
} 
