{
	"error" : null,
	"command" : "/usr/lib64/R/bin/exec/R --no-echo --no-restore --no-save --slave --file=/home/janneke/TCPDBench/execs/R/cpdbench_changepoint.R --args -i /home/janneke/TCPDBench/datasets/co2_canada.json -p MBIC -f mean -t Normal -m AMOC",
	"script" : "/home/janneke/TCPDBench/execs/R/cpdbench_changepoint.R",
	"script_md5" : "6175ed267f515e2958637075675272db",
	"hostname" : "hex-portable",
	"dataset" : "co2_canada",
	"dataset_md5" : "de8d2cac911d2a8e3ce5addacbaed8e0",
	"status" : "SUCCESS",
	"parameters" : {
		"func" : "mean",
		"max_cp" : "max",
		"method" : "AMOC",
		"penalty" : "MBIC",
		"test_statistic" : "Normal"
	},
	"result" : {
		"cplocations" : [
			106
		],
		"runtime" : 0.003042221
	}
} 
