{
	"error" : null,
	"command" : "/usr/lib64/R/bin/exec/R --no-echo --no-restore --no-save --slave --file=/home/janneke/TCPDBench/execs/R/cpdbench_changepoint.R --args -i /home/janneke/TCPDBench/datasets/homeruns.json -p MBIC -f mean -t Normal -m PELT",
	"script" : "/home/janneke/TCPDBench/execs/R/cpdbench_changepoint.R",
	"script_md5" : "6175ed267f515e2958637075675272db",
	"hostname" : "hex-portable",
	"dataset" : "homeruns",
	"dataset_md5" : "987bbab63e2c72acba1c07325303720c",
	"status" : "SUCCESS",
	"parameters" : {
		"func" : "mean",
		"max_cp" : "max",
		"method" : "PELT",
		"penalty" : "MBIC",
		"test_statistic" : "Normal"
	},
	"result" : {
		"cplocations" : [
			59,
			117
		],
		"runtime" : 0.001782179
	}
} 
