{"command": "/home/janneke/TCPDBench/execs/python/cpdbench_zero.py -i /home/janneke/TCPDBench/datasets/shanghai_license.json", "dataset": "shanghai_license", "dataset_md5": "b4ac173eb6c0a1a4d10268abc109eda1", "error": "None", "hostname": "hex", "parameters": {}, "result": {"cplocations": [], "runtime": 4.76837158203125e-07}, "script": "/home/janneke/TCPDBench/execs/python/cpdbench_zero.py", "script_md5": "95b65ddd5669b41385966a4aad387118", "status": "SUCCESS"}