{
	"error" : null,
	"command" : "/usr/lib64/R/bin/exec/R --no-echo --no-restore --no-save --slave --file=/home/janneke/TCPDBench/execs/R/cpdbench_changepoint.R --args -i /home/janneke/TCPDBench/datasets/debt_ireland.json -p MBIC -f mean -t Normal -m BinSeg -Q default",
	"script" : "/home/janneke/TCPDBench/execs/R/cpdbench_changepoint.R",
	"script_md5" : "6175ed267f515e2958637075675272db",
	"hostname" : "hex-portable",
	"dataset" : "debt_ireland",
	"dataset_md5" : "a5a9e752c338d2ffcceb614bb2064cc9",
	"status" : "SUCCESS",
	"parameters" : {
		"Q" : 5,
		"func" : "mean",
		"max_cp" : "default",
		"method" : "BinSeg",
		"penalty" : "MBIC",
		"test_statistic" : "Normal"
	},
	"result" : {
		"cplocations" : [
			8,
			20
		],
		"runtime" : 0.001036644
	}
} 
