{"command": "/home/janneke/TCPDBench/execs/python/cpdbench_zero.py -i /home/janneke/TCPDBench/datasets/quality_control_3.json", "dataset": "quality_control_3", "dataset_md5": "94f55ddedd03197bc3e660f6e1d840ee", "error": "None", "hostname": "hex", "parameters": {}, "result": {"cplocations": [], "runtime": 7.152557373046875e-07}, "script": "/home/janneke/TCPDBench/execs/python/cpdbench_zero.py", "script_md5": "95b65ddd5669b41385966a4aad387118", "status": "SUCCESS"}