{
	"error" : null,
	"command" : "/usr/lib64/R/bin/exec/R --no-echo --no-restore --no-save --slave --file=/home/janneke/TCPDBench/execs/R/cpdbench_ocp.R --args -i /home/janneke/TCPDBench/datasets/occupancy.json -l 100 --prior-a 1.0 --prior-b 1.0 --prior-k 1.0",
	"script" : "/home/janneke/TCPDBench/execs/R/cpdbench_ocp.R",
	"script_md5" : "909dde17ff91cf60fd649fd6e75ac2fd",
	"hostname" : "hex-portable",
	"dataset" : "occupancy",
	"dataset_md5" : "bc6cd9adaf496fe30bf0e417d2c3b0c6",
	"status" : "SUCCESS",
	"parameters" : {
		"missPts" : "none",
		"cpthreshold" : 0.5,
		"truncRlim" : 0.0001,
		"minRlength" : 1,
		"maxRlength" : 10000,
		"minsep" : 1,
		"maxsep" : 10000,
		"multivariate" : true,
		"lambda" : 100,
		"prior_a" : 1,
		"prior_b" : 1,
		"prior_k" : 1
	},
	"result" : {
		"cplocations" : [
			0,
			8,
			52,
			58,
			91,
			94,
			142,
			181,
			185,
			239,
			264,
			285,
			341,
			351,
			416,
			419,
			439,
			451,
			461,
			506
		],
		"runtime" : 0.3224378
	}
} 
