{
	"error" : null,
	"command" : "/usr/lib64/R/bin/exec/R --no-echo --no-restore --no-save --slave --file=/home/janneke/TCPDBench/execs/R/cpdbench_ecp.R --args -i /home/janneke/TCPDBench/datasets/gdp_argentina.json -a e.divisive --alpha 1.0 --minsize 30 --runs 199 --siglvl 0.05",
	"script" : "/home/janneke/TCPDBench/execs/R/cpdbench_ecp.R",
	"script_md5" : "1b71ad311b8354aa3d1594488eb7dea2",
	"hostname" : "hex-portable",
	"dataset" : "gdp_argentina",
	"dataset_md5" : "694212b5682ebd808d740ffd83d4bc16",
	"status" : "SUCCESS",
	"parameters" : {
		"k" : "null",
		"algorithm" : "e.divisive",
		"alpha" : 1,
		"cost" : 1,
		"maxcp" : null,
		"minsize" : 30,
		"runs" : 199,
		"siglvl" : 0.05
	},
	"result" : {
		"cplocations" : [
			0,
			59
		],
		"runtime" : 0.001590014
	}
} 
