{"error": "None", "command": "/usr/lib/R/bin/exec/R --no-echo --no-restore --no-save --slave --file=/home/janneke/TCPDBench/execs/R/cpdbench_changepoint.R --args -i /home/janneke/TCPDBench/datasets/quality_control_4.json -p MBIC -f mean -t Normal -m BinSeg -Q default", "script": "/home/janneke/TCPDBench/execs/R/cpdbench_changepoint.R", "script_md5": "6175ed267f515e2958637075675272db", "hostname": "hex", "dataset": "quality_control_4", "dataset_md5": "1efedb9a52cd0b9a9250cf9781c5f7ef", "status": "SUCCESS", "parameters": {"Q": 5, "func": "mean", "max_cp": "default", "method": "BinSeg", "penalty": "MBIC", "test_statistic": "Normal"}, "result": {"cplocations": [157, 287, 341, 467, 499], "runtime": 0.00696969}}