{
	"error" : "This method has no support for multidimensional data.",
	"command" : "/usr/lib64/R/bin/exec/R --no-echo --no-restore --no-save --slave --file=/home/janneke/TCPDBench/execs/R/cpdbench_changepoint.R --args -i /home/janneke/TCPDBench/datasets/bee_waggle_6.json -p MBIC -f mean -t Normal -m PELT",
	"script" : "/home/janneke/TCPDBench/execs/R/cpdbench_changepoint.R",
	"script_md5" : "6175ed267f515e2958637075675272db",
	"hostname" : "hex-portable",
	"dataset" : "bee_waggle_6",
	"dataset_md5" : "4f03feafecb3be0b069b3cb0d6b17d4f",
	"status" : "SKIP",
	"parameters" : {
		"func" : "mean",
		"max_cp" : "max",
		"method" : "PELT",
		"penalty" : "MBIC",
		"test_statistic" : "Normal"
	},
	"result" : {
		"cplocations" : null,
		"runtime" : null
	}
} 
