{
	"error" : null,
	"command" : "/usr/lib64/R/bin/exec/R --no-echo --no-restore --no-save --slave --file=/home/janneke/TCPDBench/execs/R/cpdbench_ecp.R --args -i /home/janneke/TCPDBench/datasets/quality_control_1.json -a e.divisive --alpha 1.0 --minsize 30 --runs 199 --siglvl 0.05",
	"script" : "/home/janneke/TCPDBench/execs/R/cpdbench_ecp.R",
	"script_md5" : "1b71ad311b8354aa3d1594488eb7dea2",
	"hostname" : "hex-portable",
	"dataset" : "quality_control_1",
	"dataset_md5" : "fcfd5b0323a0dbd499c22b32c77f6a43",
	"status" : "SUCCESS",
	"parameters" : {
		"k" : "null",
		"algorithm" : "e.divisive",
		"alpha" : 1,
		"cost" : 1,
		"maxcp" : null,
		"minsize" : 30,
		"runs" : 199,
		"siglvl" : 0.05
	},
	"result" : {
		"cplocations" : [
			0,
			87,
			144,
			206,
			313
		],
		"runtime" : 0.894192
	}
} 
