{
	"error" : null,
	"command" : "/usr/lib64/R/bin/exec/R --no-echo --no-restore --no-save --slave --file=/home/janneke/TCPDBench/execs/R/cpdbench_changepoint.R --args -i /home/janneke/TCPDBench/datasets/scanline_126007.json -p BIC -f mean -t Normal -m SegNeigh -Q default",
	"script" : "/home/janneke/TCPDBench/execs/R/cpdbench_changepoint.R",
	"script_md5" : "6175ed267f515e2958637075675272db",
	"hostname" : "hex-portable",
	"dataset" : "scanline_126007",
	"dataset_md5" : "057d5741b623308af00c42e2c8e525c3",
	"status" : "SUCCESS",
	"parameters" : {
		"Q" : 5,
		"func" : "mean",
		"max_cp" : "default",
		"method" : "SegNeigh",
		"penalty" : "BIC",
		"test_statistic" : "Normal"
	},
	"result" : {
		"cplocations" : [
			291,
			324,
			375,
			402,
			480
		],
		"runtime" : 0.05772734
	}
} 
