{
	"error" : null,
	"command" : "/usr/lib64/R/bin/exec/R --no-echo --no-restore --no-save --slave --file=/home/janneke/TCPDBench/execs/R/cpdbench_changepoint.R --args -i /home/janneke/TCPDBench/datasets/brent_spot.json -p MBIC -f mean -t Normal -m BinSeg -Q default",
	"script" : "/home/janneke/TCPDBench/execs/R/cpdbench_changepoint.R",
	"script_md5" : "6175ed267f515e2958637075675272db",
	"hostname" : "hex-portable",
	"dataset" : "brent_spot",
	"dataset_md5" : "79892116ef8a0aa16e2450123655b31d",
	"status" : "SUCCESS",
	"parameters" : {
		"Q" : 5,
		"func" : "mean",
		"max_cp" : "default",
		"method" : "BinSeg",
		"penalty" : "MBIC",
		"test_statistic" : "Normal"
	},
	"result" : {
		"cplocations" : [
			139,
			279,
			378,
			499
		],
		"runtime" : 0.001363993
	}
} 
