{
	"error" : null,
	"command" : "/usr/lib/R/bin/exec/R --no-echo --no-restore --no-save --slave --file=/home/janneke/TCPDBench/execs/R/cpdbench_prophet.R --args -i /home/janneke/TCPDBench/datasets/construction.json -N default",
	"script" : "/home/janneke/TCPDBench/execs/R/cpdbench_prophet.R",
	"script_md5" : "651dab1a04514f68e3d9719059dbc93f",
	"hostname" : "hex",
	"dataset" : "construction",
	"dataset_md5" : "fb0347dc9fd353b11b35e99f7d531f13",
	"status" : "SUCCESS",
	"parameters" : {
		"changepoint.range" : 1,
		"threshold" : 0.01,
		"yearly.seasonality" : "auto",
		"weekly.seasonality" : "auto",
		"daily.seasonality" : "auto",
		"Nmax" : 25
	},
	"result" : {
		"cplocations" : [
			76,
			89,
			102,
			114,
			127,
			140,
			153,
			229
		],
		"runtime" : 0.2675447
	}
} 
