{
	"error" : null,
	"command" : "/usr/lib64/R/bin/exec/R --no-echo --no-restore --no-save --slave --file=/home/janneke/TCPDBench/execs/R/cpdbench_changepoint.R --args -i /home/janneke/TCPDBench/datasets/gdp_argentina.json -p BIC -f mean -t Normal -m SegNeigh -Q default",
	"script" : "/home/janneke/TCPDBench/execs/R/cpdbench_changepoint.R",
	"script_md5" : "6175ed267f515e2958637075675272db",
	"hostname" : "hex-portable",
	"dataset" : "gdp_argentina",
	"dataset_md5" : "694212b5682ebd808d740ffd83d4bc16",
	"status" : "SUCCESS",
	"parameters" : {
		"Q" : 5,
		"func" : "mean",
		"max_cp" : "default",
		"method" : "SegNeigh",
		"penalty" : "BIC",
		"test_statistic" : "Normal"
	},
	"result" : {
		"cplocations" : [
			31,
			46,
			58
		],
		"runtime" : 0.003128052
	}
} 
