{
	"error" : "This method has no support for multidimensional data.",
	"command" : "/usr/lib64/R/bin/exec/R --no-echo --no-restore --no-save --slave --file=/home/janneke/TCPDBench/execs/R/cpdbench_prophet.R --args -i /home/janneke/TCPDBench/datasets/run_log.json -N default",
	"script" : "/home/janneke/TCPDBench/execs/R/cpdbench_prophet.R",
	"script_md5" : "651dab1a04514f68e3d9719059dbc93f",
	"hostname" : "hex-portable",
	"dataset" : "run_log",
	"dataset_md5" : "2c78a8fa0b4a2f8e2d22ba3ad4dfd49f",
	"status" : "SKIP",
	"parameters" : {
		"changepoint.range" : 1,
		"threshold" : 0.01,
		"yearly.seasonality" : "auto",
		"weekly.seasonality" : "auto",
		"daily.seasonality" : "auto",
		"Nmax" : 25
	},
	"result" : {
		"cplocations" : null,
		"runtime" : null
	}
} 
