{"error": "None", "command": "/usr/lib/R/bin/exec/R --no-echo --no-restore --no-save --slave --file=/home/janneke/TCPDBench/execs/R/cpdbench_ocp.R --args -i /home/janneke/TCPDBench/datasets/quality_control_4.json -l 100 --prior-a 1.0 --prior-b 1.0 --prior-k 1.0", "script": "/home/janneke/TCPDBench/execs/R/cpdbench_ocp.R", "script_md5": "909dde17ff91cf60fd649fd6e75ac2fd", "hostname": "hex", "dataset": "quality_control_4", "dataset_md5": "1efedb9a52cd0b9a9250cf9781c5f7ef", "status": "SUCCESS", "parameters": {"missPts": "none", "cpthreshold": 0.5, "truncRlim": 0.0001, "minRlength": 1, "maxRlength": 10000, "minsep": 1, "maxsep": 10000, "multivariate": false, "lambda": 100, "prior_a": 1, "prior_b": 1, "prior_k": 1}, "result": {"cplocations": [0, 158, 197, 267, 289, 342, 468, 488], "runtime": 0.2278986}}