{
	"error" : null,
	"command" : "/usr/lib64/R/bin/exec/R --no-echo --no-restore --no-save --slave --file=/home/janneke/TCPDBench/execs/R/cpdbench_changepoint.R --args -i /home/janneke/TCPDBench/datasets/measles.json -p MBIC -f mean -t Normal -m PELT",
	"script" : "/home/janneke/TCPDBench/execs/R/cpdbench_changepoint.R",
	"script_md5" : "6175ed267f515e2958637075675272db",
	"hostname" : "hex-portable",
	"dataset" : "measles",
	"dataset_md5" : "e42afd03be893fc7deb98514c94fa4c7",
	"status" : "SUCCESS",
	"parameters" : {
		"func" : "mean",
		"max_cp" : "max",
		"method" : "PELT",
		"penalty" : "MBIC",
		"test_statistic" : "Normal"
	},
	"result" : {
		"cplocations" : [
			149,
			178,
			255,
			275,
			369,
			393,
			472,
			496,
			572,
			596,
			681,
			701,
			777,
			807,
			990
		],
		"runtime" : 0.001526117
	}
} 
