{
	"error" : "This method has no support for multidimensional data.",
	"command" : "/usr/lib64/R/bin/exec/R --no-echo --no-restore --no-save --slave --file=/home/janneke/TCPDBench/execs/R/cpdbench_changepoint.R --args -i /home/janneke/TCPDBench/datasets/occupancy.json -p BIC -f mean -t Normal -m SegNeigh -Q default",
	"script" : "/home/janneke/TCPDBench/execs/R/cpdbench_changepoint.R",
	"script_md5" : "6175ed267f515e2958637075675272db",
	"hostname" : "hex-portable",
	"dataset" : "occupancy",
	"dataset_md5" : "bc6cd9adaf496fe30bf0e417d2c3b0c6",
	"status" : "SKIP",
	"parameters" : {
		"Q" : 5,
		"func" : "mean",
		"max_cp" : "default",
		"method" : "SegNeigh",
		"penalty" : "BIC",
		"test_statistic" : "Normal"
	},
	"result" : {
		"cplocations" : null,
		"runtime" : null
	}
} 
