{"error": "None", "command": "/usr/lib/R/bin/exec/R --no-echo --no-restore --no-save --slave --file=/home/janneke/TCPDBench/execs/R/cpdbench_changepoint.R --args -i /home/janneke/TCPDBench/datasets/quality_control_2.json -p MBIC -f mean -t Normal -m AMOC", "script": "/home/janneke/TCPDBench/execs/R/cpdbench_changepoint.R", "script_md5": "6175ed267f515e2958637075675272db", "hostname": "hex", "dataset": "quality_control_2", "dataset_md5": "919a55440bd00d635db80fe83e921c7d", "status": "SUCCESS", "parameters": {"func": "mean", "max_cp": "max", "method": "AMOC", "penalty": "MBIC", "test_statistic": "Normal"}, "result": {"cplocations": [96], "runtime": 0.002183199}}