{
	"error" : "Missing value: NA is not allowed in the data as changepoint methods are only sensible for regularly spaced data.",
	"command" : "/usr/lib64/R/bin/exec/R --no-echo --no-restore --no-save --slave --file=/home/janneke/TCPDBench/execs/R/cpdbench_changepoint.R --args -i /home/janneke/TCPDBench/datasets/uk_coal_employ.json -p MBIC -f mean -t Normal -m AMOC",
	"script" : "/home/janneke/TCPDBench/execs/R/cpdbench_changepoint.R",
	"script_md5" : "6175ed267f515e2958637075675272db",
	"hostname" : "hex-portable",
	"dataset" : "uk_coal_employ",
	"dataset_md5" : "a7c72746e46d6e09f516bd87e0e68bef",
	"status" : "FAIL",
	"parameters" : {
		"func" : "mean",
		"max_cp" : "max",
		"method" : "AMOC",
		"penalty" : "MBIC",
		"test_statistic" : "Normal"
	},
	"result" : {
		"cplocations" : null,
		"runtime" : null
	}
} 
