{
	"command": "/home/janneke/TCPDBench/execs/python/cpdbench_zero.py -i /home/janneke/TCPDBench/datasets/ozone.json",
	"dataset": "ozone",
	"dataset_md5": "348b1f85c3ec3da3b8989afe04c33b80",
	"error": null,
	"hostname": "hex-portable",
	"parameters": {},
	"result": {
		"cplocations": [],
		"runtime": 4.76837158203125e-07
	},
	"script": "/home/janneke/TCPDBench/execs/python/cpdbench_zero.py",
	"script_md5": "95b65ddd5669b41385966a4aad387118",
	"status": "SUCCESS"
}
